{
  "kind": "seevee.workspace",
  "schemaVersion": "1.0.0",
  "id": "ws_demo",
  "revision": 0,
  "createdAt": "2026-09-23T00:00:00.000Z",
  "updatedAt": "2026-09-23T00:00:00.000Z",
  "data": {
    "name": "Linked schema example",
    "active": {
      "cvId": "cv_demo",
      "presentationId": "pres_demo"
    },
    "resources": {
      "cvs": {
        "cv_demo": {
          "path": "cvs/demo.json",
          "name": "Software Engineer",
          "target": "General software engineering",
          "provenanceId": "provdoc_demo",
          "commentsId": "comments_demo",
          "defaultPresentationId": "pres_demo",
          "archived": false
        }
      },
      "presentations": {
        "pres_demo": {
          "path": "presentations/demo.json",
          "cvId": "cv_demo",
          "name": "Minimal A4"
        }
      },
      "provenance": {
        "provdoc_demo": {
          "path": "provenance/demo.json"
        }
      },
      "comments": {
        "comments_demo": {
          "path": "comments/demo.json"
        }
      },
      "sources": {
        "src_demo": {
          "path": "sources/src_demo.json"
        }
      }
    },
    "policy": {
      "allowAgentFactInference": false,
      "requireEvidenceForNumericClaims": true,
      "allowForceExportWithOverflow": false,
      "autoResolveDeterministicComments": false
    },
    "extensions": {}
  }
}
